{
  "schema_version": "1",
  "record_type": "platform_authority_lambda_audit_repair_phase_b_identity_binding",
  "environment": "non-production",
  "production": false,
  "authority_account_id": "042360977644",
  "management_account_id": "839393571433",
  "region": "us-east-1",
  "identity_center_application_arn": "arn:aws:sso::839393571433:application/ssoins-1234567890abcdef/apl-1234567890abcdef",
  "identity_center_instance_arn": "arn:aws:sso:::instance/ssoins-1234567890abcdef",
  "identity_store_arn": "arn:aws:identitystore::839393571433:identitystore/d-1234567890",
  "redirect_uri": "http://127.0.0.1:43119/callback",
  "operator_user_id": "11111111-2222-4333-8444-555555555555",
  "invoker_role_arn": "arn:aws:iam::042360977644:role/aws-reserved/sso.amazonaws.com/AWSReservedSSO_ScanalyzeGug221PhaseBInvoker_0123456789abcdef",
  "broker_execution_role_arn": "arn:aws:iam::042360977644:role/ScanalyzeGug221PhaseBBrokerExecution",
  "proof_role_arn": "arn:aws:iam::042360977644:role/ScanalyzeGug221PhaseBProof",
  "ledger_table_arn": "arn:aws:dynamodb:us-east-1:042360977644:table/scanalyze-platform-authority-gug221-phase-b-execution-ledger",
  "stack_arn": "arn:aws:cloudformation:us-east-1:042360977644:stack/scanalyze-platform-authority-lambda-audit-repair-pep/aaaaaaaa-bbbb-4ccc-8ddd-eeeeeeeeeeee",
  "change_set_arn": "arn:aws:cloudformation:us-east-1:042360977644:changeSet/gug221-lambda-audit-repair-pep-create/11111111-2222-4333-8444-555555555555",
  "change_set_name": "gug221-lambda-audit-repair-pep-create",
  "client_request_token": "gug221-b-aaaaaaaaaaaaaaaaaaaaaaaaaaaaaaaaaaaaaaaaaaaaaaaa",
  "phase_b_intent_digest": "sha256:1111111111111111111111111111111111111111111111111111111111111111",
  "change_set_receipt_digest": "sha256:2222222222222222222222222222222222222222222222222222222222222222",
  "template_digest": "sha256:3333333333333333333333333333333333333333333333333333333333333333",
  "parameters_digest": "sha256:4444444444444444444444444444444444444444444444444444444444444444",
  "resource_inventory_digest": "sha256:5555555555555555555555555555555555555555555555555555555555555555",
  "ledger_controls_digest": "sha256:6666666666666666666666666666666666666666666666666666666666666666",
  "oauth_state_digest": "sha256:abababababababababababababababababababababababababababababababab",
  "invoker_policy_sha256": "aaaaaaaaaaaaaaaaaaaaaaaaaaaaaaaaaaaaaaaaaaaaaaaaaaaaaaaaaaaaaaaa",
  "broker_policy_sha256": "bbbbbbbbbbbbbbbbbbbbbbbbbbbbbbbbbbbbbbbbbbbbbbbbbbbbbbbbbbbbbbbb",
  "proof_policy_sha256": "cccccccccccccccccccccccccccccccccccccccccccccccccccccccccccccccc",
  "application_actor_policy_sha256": "dddddddddddddddddddddddddddddddddddddddddddddddddddddddddddddddd",
  "broker_artifact_code_sha256": "AAAAAAAAAAAAAAAAAAAAAAAAAAAAAAAAAAAAAAAAAAA=",
  "broker_code_signing_config_arn": "arn:aws:lambda:us-east-1:042360977644:code-signing-config:csc-1234567890abcdef0",
  "broker_alias_arn": "arn:aws:lambda:us-east-1:042360977644:function:scanalyze-platform-authority-gug221-phase-b-broker:broker-v1",
  "broker_topology_provider_evidence_digest": "sha256:eeeeeeeeeeeeeeeeeeeeeeeeeeeeeeeeeeeeeeeeeeeeeeeeeeeeeeeeeeeeeeee",
  "broker_topology_signing_key_arn": "arn:aws:kms:us-east-1:042360977644:key/12345678-1234-4234-8234-123456789abc",
  "broker_topology_signature_algorithm": "ECDSA_SHA_256",
  "provider_readback_required": true,
  "provider_readback_evidence_bound": true,
  "live_provider_state_verified_by_broker": false,
  "broker_topology_sha256": "sha256:ffffffffffffffffffffffffffffffffffffffffffffffffffffffffffffffff",
  "execution_request_digest": "sha256:7777777777777777777777777777777777777777777777777777777777777777",
  "execution_id": "gug221-phase-b-8888888888888888888888888888888888888888888888888888888888888888",
  "execution_not_before": "2030-01-01T00:00:00Z",
  "execution_not_after": "2030-01-01T00:15:00Z",
  "proof_duration_seconds": 900,
  "max_token_lifetime_seconds": 900,
  "identity_session_mode": "IDENTITY_ENHANCED_PROOF_ONLY",
  "direct_identity_session_execute_change_set": false,
  "effect_principal_type": "AWS_SERVICE_ROLE",
  "native_on_behalf_of": false,
  "binding_digest": "sha256:9999999999999999999999999999999999999999999999999999999999999999"
}
